Orientador,Frequencia,Offset,Timestamp_Coleta
"Abbad, Gardênia da Silva",51,0,2026-01-15T10:17:34.336867
"Abbas, Cláudia Jacy Barenco",3,0,2026-01-15T10:17:34.336867
"Abdalla Júnior, Humberto",21,0,2026-01-15T10:17:34.336867
"Abdalla-Filho, Elias",2,0,2026-01-15T10:17:34.336867
"Abdelnur, Patrícia Verardi",1,0,2026-01-15T10:17:34.336867
"Abers, Rebecca Neaera",26,0,2026-01-15T10:17:34.336867
"Abib, Fernando Cesar",1,0,2026-01-15T10:17:34.336867
"Abrahão, Júlia Issy",16,0,2026-01-15T10:17:34.336867
"Abrantes, Paulo Cesar Coelho",7,0,2026-01-15T10:17:34.336867
"Abreu, Alexandre Maduro",7,0,2026-01-15T10:17:34.336867
"Abreu, Breno Tenório Ramalho de",5,0,2026-01-15T10:17:34.336867
"Abreu, Delmary Vasconcelos de",25,0,2026-01-15T10:17:34.336867
"Abreu, Helana Célia de Freitas",1,0,2026-01-15T10:17:34.336867
"Abreu, Lucijane Monteiro de",22,0,2026-01-15T10:17:34.336867
"Abreu, Teresa Lúcia Muricy de",3,0,2026-01-15T10:17:34.336867
"Abreu-Rodrigues, Josele",27,0,2026-01-15T10:17:34.336867
"Acciarri, Cristina",6,0,2026-01-15T10:17:34.336867
"Accornero, Guya",1,0,2026-01-15T10:17:34.336867
"Adghirni, Zélia Leal",19,0,2026-01-15T10:17:34.336867
"Affonso Neto, Annibal",2,0,2026-01-15T10:17:34.336867
"Aggio, Natalia Maria",4,0,2026-01-15T10:17:34.336867
"Agostini-Costa, Tânia da Silveira",1,0,2026-01-15T10:17:34.336867
"Aguayo, Leonardo",1,0,2026-01-15T10:17:34.336867
"Aguiar, Alexandre Kehrig Veronese",13,0,2026-01-15T10:17:34.336867
"Aguiar, Antonio José Camillo de",8,0,2026-01-15T10:17:34.336867
"Aguiar, Carla Silva Rocha",2,0,2026-01-15T10:17:34.336867
"Aguiar, Ludmilla Moura de Souza",29,0,2026-01-15T10:17:34.336867
"Aguiar, Roberto Armando Ramos de",3,0,2026-01-15T10:17:34.336867
"Aguiar, Ronaldo Conde",1,0,2026-01-15T10:17:34.336867
"Akutsu, Rita de Cássia Coelho de Almeida",13,0,2026-01-15T10:17:34.336867
"Albernaz, Lorena Carneiro",1,0,2026-01-15T10:17:34.336867
"Albuquerque, Conceição de Maria Alves de",1,0,2026-01-15T10:17:34.336867
"Albuquerque, Éder Lima de",23,0,2026-01-15T10:17:34.336867
"Albuquerque, Lidiamar Barbosa",1,0,2026-01-15T10:17:34.336867
"Albuquerque, Olga Maria Ramalho de",2,0,2026-01-15T10:17:34.336867
"Albuquerque, P.M.Xavier de",1,0,2026-01-15T10:17:34.336867
"Albuquerque, Pedro Henrique Melo",9,0,2026-01-15T10:17:34.336867
"Albuquerque, Robson de Oliveira",6,0,2026-01-15T10:17:34.336867
"Albuquerque, Rodrigo",1,0,2026-01-15T10:17:34.336867
"Alcalde, Víctor Hugo Casanova",2,0,2026-01-15T10:17:34.336867
"Alchieri, Eduardo Adilio Pelinson",10,0,2026-01-15T10:17:34.336867
"Alencar, Cristina Miranda de",1,0,2026-01-15T10:17:34.336867
"Alencar, Ernandes Rodrigues de",13,0,2026-01-15T10:17:34.336867
"Alencar, Eunice Maria Lima Soriano de",3,0,2026-01-15T10:17:34.336867
"Alfaro, Sadek Crisóstomo Absi",26,0,2026-01-15T10:17:34.336867
"Alfinito, Solange",15,0,2026-01-15T10:17:34.336867
"Alho, Cleber José Rodrigues",5,0,2026-01-15T10:17:34.336867
"Aliabadi, M. H.",1,0,2026-01-15T10:17:34.336867
"Aliaga Fuentes, Maribel Del Carmen",2,0,2026-01-15T10:17:34.336867
"Almarza, Sara",16,0,2026-01-15T10:17:34.336867
"Almeida Filho, Eclair Antonio",17,50,2026-01-15T10:17:36.663509
"Almeida Filho, Eclair de",1,50,2026-01-15T10:17:36.663509
"Almeida Filho, José Carlos Paes de",42,50,2026-01-15T10:17:36.663509
"Almeida Junior, Jose Maria Gonçalves de",1,50,2026-01-15T10:17:36.663509
"Almeida Júnior, Nalvo Franco",1,50,2026-01-15T10:17:36.663509
"Almeida Neto, Mário",1,50,2026-01-15T10:17:36.663509
"Almeida, Alexandre Nascimento de",23,50,2026-01-15T10:17:36.663509
"Almeida, Angela Maria de Oliveira",13,50,2026-01-15T10:17:36.663509
"Almeida, Débora Cristina Rezende de",13,50,2026-01-15T10:17:36.663509
"Almeida, Dulce Maria Filgueira de",17,50,2026-01-15T10:17:36.663509
"Almeida, Eneá de Stutz e",15,50,2026-01-15T10:17:36.663509
"Almeida, Fernanda Vasconcelos de",7,50,2026-01-15T10:17:36.663509
"Almeida, Frederico Machado",1,50,2026-01-15T10:17:36.663509
"Almeida, Inês Maria Marques Zanforlin Pires de",45,50,2026-01-15T10:17:36.663509
"Almeida, Jaime de",22,50,2026-01-15T10:17:36.663509
"Almeida, Jaime Gonçalves de",31,50,2026-01-15T10:17:36.663509
"Almeida, João Ricardo Moreira de",13,50,2026-01-15T10:17:36.663509
"Almeida, Júlio César Franco",1,50,2026-01-15T10:17:36.663509
"Almeida, Maria Cecília Pedreira de",6,50,2026-01-15T10:17:36.663509
"Almeida, Maria das Graças Gardoni",1,50,2026-01-15T10:17:36.663509
"Almeida, Maria do Rosário Guimarães",1,50,2026-01-15T10:17:36.663509
"Almeida, Pedro Paulo Palazzo de",9,50,2026-01-15T10:17:36.663509
"Almeida, Ricardo Miyasaka de",9,50,2026-01-15T10:17:36.663509
"Almeida, Ricardo Titze de",16,50,2026-01-15T10:17:36.663509
"Almeida, Rodrigo Bonifácio de",17,50,2026-01-15T10:17:36.663509
"Almeida, Tânia Mara Campos de",22,50,2026-01-15T10:17:36.663509
"Almeida, Tati de",3,50,2026-01-15T10:17:36.663509
"Almeida, Vanessa Borges de",15,50,2026-01-15T10:17:36.663509
"Almeida, Wagner Santos de",4,50,2026-01-15T10:17:36.663509
"Almeida, Wellington Lourenço de",9,50,2026-01-15T10:17:36.663509
"Aló, Raquel Moreira",2,50,2026-01-15T10:17:36.663509
"Alonso López, Ramón Fabian",8,50,2026-01-15T10:17:36.663509
"Altafin, Iara Guimarães",2,50,2026-01-15T10:17:36.663509
"Alvarenga, Carlos José Souza de",12,50,2026-01-15T10:17:36.663509
"Alvarenga, Lídia",1,50,2026-01-15T10:17:36.663509
"Alvarenga, Magali Barçante",5,50,2026-01-15T10:17:36.663509
"Álvares, Alberto José",20,50,2026-01-15T10:17:36.663509
"Alvares, Lillian Maria Araújo de Rezende",17,50,2026-01-15T10:17:36.663509
"Alvarez, Maria Luisa Ortíz",3,50,2026-01-15T10:17:36.663509
"Alvarez, Rosicler Rocha Aiza",9,50,2026-01-15T10:17:36.663509
"Alves, Aline Teixeira",3,50,2026-01-15T10:17:36.663509
"Alves, Ana Cristina de Jesus",7,50,2026-01-15T10:17:36.663509
"Alves, Carlos André de Melo",12,50,2026-01-15T10:17:36.663509
"Alves, Cecília Brito",2,50,2026-01-15T10:17:36.663509
"Alves, Conceição de Maria Albuquerque",18,50,2026-01-15T10:17:36.663509
"Alves, Elioenai Dornelles",26,50,2026-01-15T10:17:36.663509
"Alves, Fernando Mascarenhas",12,50,2026-01-15T10:17:36.663509
"Alves, Flávia de Castro",6,50,2026-01-15T10:17:36.663509
"Alves, Geraldo Eleno Silveira",1,50,2026-01-15T10:17:36.663509
"Alves, Isabel Teresa Gama",14,50,2026-01-15T10:17:36.663509
"Alves, Janaína Soares",2,100,2026-01-15T10:17:38.858661
"Alves, Janaína Soares de Oliveira",3,100,2026-01-15T10:17:38.858661
"Alves, José Carlos Moreira",2,100,2026-01-15T10:17:38.858661
"Alves, Maria Elaene Rodrigues",1,100,2026-01-15T10:17:38.858661
"Alves, Ministro Moreira",1,100,2026-01-15T10:17:38.858661
"Alves, Plinio Ricardo Ganime",4,100,2026-01-15T10:17:38.858661
"Alves, Soraya Ferreira",16,100,2026-01-15T10:17:38.858661
"Alves, Vander Ramos",16,100,2026-01-15T10:17:38.858661
"Alvim, Clara de Andrade",1,100,2026-01-15T10:17:38.858661
"Alvim, Pedro de Andrade",4,100,2026-01-15T10:17:38.858661
"Amabile, Renato Fernando",1,100,2026-01-15T10:17:38.858661
"Amado, Adriana Moreira",11,100,2026-01-15T10:17:38.858661
"Amado, Veronica Moreira",8,100,2026-01-15T10:17:38.858661
"Amaral, Dino Macedo",1,100,2026-01-15T10:17:38.858661
"Amaral, Luciene Ferreira Gaspar",2,100,2026-01-15T10:17:38.858661
"Amaral, Sueli Angélica do",27,100,2026-01-15T10:17:38.858661
"Amaro, José Luis Martinez",7,100,2026-01-15T10:17:38.858661
"Amaro, Rosana",4,100,2026-01-15T10:17:38.858661
"Amato, Angélica Amorim",39,100,2026-01-15T10:17:38.858661
"Amato, Daniela Amorim",1,100,2026-01-15T10:17:38.858661
"Amato, Marco Antonio",13,100,2026-01-15T10:17:38.858661
"Amazonas, Maurício de Carvalho",10,100,2026-01-15T10:17:38.858661
"Amiel, Tel",5,100,2026-01-15T10:17:38.858661
"Amorim, Ariuska Karla Barbosa",17,100,2026-01-15T10:17:38.858661
"Amorim, Cláudia Naves David",37,100,2026-01-15T10:17:38.858661
"Amorim, Fábio Ferreira",4,100,2026-01-15T10:17:38.858661
"Amorim, José Salomão David",2,100,2026-01-15T10:17:38.858661
"Amorim, Karla Patrícia Cardoso",1,100,2026-01-15T10:17:38.858661
"Amorim, Ricardo Santos Silva",1,100,2026-01-15T10:17:38.858661
"Amorim, Rivadávio Fernandes Batista de",11,100,2026-01-15T10:17:38.858661
"Amorim, Ronni Geraldo Gomes de",27,100,2026-01-15T10:17:38.858661
"Amparo, Deise Matos do",26,100,2026-01-15T10:17:38.858661
"Amvame-Nze, Georges Daniel",13,100,2026-01-15T10:17:38.858661
"Ancona Lopez, André Porto",20,100,2026-01-15T10:17:38.858661
"Andorno, Roberto",1,100,2026-01-15T10:17:38.858661
"Andrada, Alexandre Flávio Silva",5,100,2026-01-15T10:17:38.858661
"Andrade Filho, João Evangelista de",1,100,2026-01-15T10:17:38.858661
"Andrade, Alan Carvalho",3,100,2026-01-15T10:17:38.858661
"Andrade, Bernardo Borba de",5,100,2026-01-15T10:17:38.858661
"Andrade, Carlos Kleber Zago de",25,100,2026-01-15T10:17:38.858661
"Andrade, Eduardo Dias de",1,100,2026-01-15T10:17:38.858661
"Andrade, Erika dos Reis Gusmão",1,100,2026-01-15T10:17:38.858661
"Andrade, Jairo Eduardo Borges",4,100,2026-01-15T10:17:38.858661
"Andrade, Joanlise Marco de Leon",4,100,2026-01-15T10:17:38.858661
"Andrade, Joaquim Pinto de",30,100,2026-01-15T10:17:38.858661
"Andrade, Josemberg Moura de",10,100,2026-01-15T10:17:38.858661
"Andrade, Laise Rodrigues de",1,100,2026-01-15T10:17:38.858661
"Andrade, Liza Maria Souza de",17,100,2026-01-15T10:17:38.858661
"Andrade, Manoel Pereira de",1,100,2026-01-15T10:17:38.858661
"Andrade, Marcelino Monteiro de",9,100,2026-01-15T10:17:38.858661
"Andrade, Mariana Malard Sales",1,150,2026-01-15T10:17:41.068358
"Andrade, Mariana Rosa Mastrella de",25,150,2026-01-15T10:17:41.068358
"Andrade, Michelle",18,150,2026-01-15T10:17:41.068358
"Andrade, Miguel Gally de",13,150,2026-01-15T10:17:41.068358
"Andrade, Rafael Leite Pinto de",1,150,2026-01-15T10:17:41.068358
"Andrade, Renata Marson Teixeira de",1,150,2026-01-15T10:17:41.068358
"Andrade, Rosângela Vieira de",1,150,2026-01-15T10:17:41.068358
"Andrade, Vanessa Carvalho de",18,150,2026-01-15T10:17:41.068358
"Anflor, Carla Tatiana Mota",16,150,2026-01-15T10:17:41.068358
"Angarita, Jorge Andrés Cormane",1,150,2026-01-15T10:17:41.068358
"Ângelo, Humberto",25,150,2026-01-15T10:17:41.068358
"Anjos, Juarez José Tuchinski dos",8,150,2026-01-15T10:17:41.068358
"Anjos, Rafael Sanzio Araújo dos",21,150,2026-01-15T10:17:41.068358
"Antloga, Carla Sabrina Xavier",14,150,2026-01-15T10:17:41.068358
"Antunes, Alexandre Araujo",1,150,2026-01-15T10:17:41.068358
"Antunes, Jorge de Freitas",1,150,2026-01-15T10:17:41.068358
"Antunes, Walda de Andrade",5,150,2026-01-15T10:17:41.068358
"Aparecida, Ana Paula Caixeta",1,150,2026-01-15T10:17:41.068358
"Aparecida, Geralda Dias",6,150,2026-01-15T10:17:41.068358
"Aquino, Renata",1,150,2026-01-15T10:17:41.068358
"Aquino, Tomás de",1,150,2026-01-15T10:17:41.068358
"Aragão, Eugênio José Guilherme de",2,150,2026-01-15T10:17:41.068358
"Aragão, Francisco José Lima",31,150,2026-01-15T10:17:41.068358
"Aragão, Joaquim José Guilherme de",21,150,2026-01-15T10:17:41.068358
"Aragão, Luiz Tarlei de",1,150,2026-01-15T10:17:41.068358
"Aranha, Diego de Freitas",1,150,2026-01-15T10:17:41.068358
"Aranha, Márcio Iorio",13,150,2026-01-15T10:17:41.068358
"Araújo Filho, José Oswaldo de",1,150,2026-01-15T10:17:41.068358
"Araújo Júnior, Rogério Henrique de",24,150,2026-01-15T10:17:41.068358
"Araújo Neto, Lineu da Costa",3,150,2026-01-15T10:17:41.068358
"Araújo Neto, Mário Diniz de",10,150,2026-01-15T10:17:41.068358
"Araújo Sobrinho, Fernando Luiz",40,150,2026-01-15T10:17:41.068358
"Araújo Sobrinho, Fernando Luíz",3,150,2026-01-15T10:17:41.068358
"Araújo, Adriana de Fátima Barbosa",5,150,2026-01-15T10:17:41.068358
"Araújo, Aletéia Patrícia Favacho de",10,150,2026-01-15T10:17:41.068358
"Araújo, Alexandre Fernandes Bamberg de",3,150,2026-01-15T10:17:41.068358
"Araujo, Ana Claudia Guerra de",2,150,2026-01-15T10:17:41.068358
"Araújo, André Gustavo de Melo",7,150,2026-01-15T10:17:41.068358
"Araújo, Aneide Oliveira",22,150,2026-01-15T10:17:41.068358
"Araújo, Antônio Francisco Pereira de",4,150,2026-01-15T10:17:41.068358
"Araújo, Caetano Ernesto Pereira de",3,150,2026-01-15T10:17:41.068358
"Araújo, Carla Nunes de",10,150,2026-01-15T10:17:41.068358
"Araújo, Claisy Maria Marinho",26,150,2026-01-15T10:17:41.068358
"Araújo, Daniel Costa",2,150,2026-01-15T10:17:41.068358
"Araújo, Daniel Mendes Pereira Ardisson de",1,150,2026-01-15T10:17:41.068358
"Araújo, Daniel Teixeira da Costa",4,150,2026-01-15T10:17:41.068358
"Araujo, Edilberto A. de",1,150,2026-01-15T10:17:41.068358
"Araújo, Felipe Saldanha de",11,150,2026-01-15T10:17:41.068358
"Araújo, Gregório Luís Silva",19,150,2026-01-15T10:17:41.068358
"Araújo, José Alexander",37,150,2026-01-15T10:17:41.068358
"Araújo, Juliana Forte Mazzeu de",22,200,2026-01-15T10:17:43.474532
"Araújo, Kellcio Oliveira",6,200,2026-01-15T10:17:43.474532
"Araújo, Kleber Villela",1,200,2026-01-15T10:17:43.474532
"Araújo, Luiz Alberto D’Ávila de",1,200,2026-01-15T10:17:43.474532
"Araújo, Nadjar Nitz Silva Lociks de",13,200,2026-01-15T10:17:43.474532
"Araújo, Neuza de Farias",17,200,2026-01-15T10:17:43.474532
"Araújo, Nivalda Assunção de",15,200,2026-01-15T10:17:43.474532
"Araújo, Raimundo Luiz Silva",1,200,2026-01-15T10:17:43.474532
"Araújo, Ricardo",11,200,2026-01-15T10:17:43.474532
"Araújo, Ricardo Silva Azevedo",10,200,2026-01-15T10:17:43.474532
"Araujo, Ronaldo Marcos de Lima",1,200,2026-01-15T10:17:43.474532
"Araújo, Shadia Husseini de",6,200,2026-01-15T10:17:43.474532
"Araújo, Suely Mara Vaz Guimarães de",4,200,2026-01-15T10:17:43.474532
"Araújo, Tatiane Regina Petrillo Pires de",1,200,2026-01-15T10:17:43.474532
"Araújo, Tereza Cristina Cavalcanti Ferreira de",35,200,2026-01-15T10:17:43.474532
"Araújo, Wildo Navegantes de",26,200,2026-01-15T10:17:43.474532
"Araújo, Wilma Maria Coelho",24,200,2026-01-15T10:17:43.474532
"Arbache Filho, Jorge Saba",9,200,2026-01-15T10:17:43.474532
"Arboleda, Daniel Maurício Munoz",3,200,2026-01-15T10:17:43.474532
"Areda, Camila Alves",3,200,2026-01-15T10:17:43.474532
"Argañaraz, Enrique Roberto",10,200,2026-01-15T10:17:43.474532
"Arraes, Flávia Cristina Cruz Lamberti",9,200,2026-01-15T10:17:43.474532
"Arraes, Virgílio Caixeta",19,200,2026-01-15T10:17:43.474532
"Arruda, Fabiana Serra de",12,200,2026-01-15T10:17:43.474532
"Arruda, Sandra Fernandes",12,200,2026-01-15T10:17:43.474532
"Assad, Luis Tadeu",2,200,2026-01-15T10:17:43.474532
"Assis, André Pacheco de",55,200,2026-01-15T10:17:43.474532
"Assis, André Pacho de",1,200,2026-01-15T10:17:43.474532
"Assis, Arthur Alfaix",12,200,2026-01-15T10:17:43.474532
"Assumpção, Marcelo Sousa",1,200,2026-01-15T10:17:43.474532
"Assunção, Nivalda",1,200,2026-01-15T10:17:43.474532
"Athayde, Pedro Fernando Avalone",7,200,2026-01-15T10:17:43.474532
"Athayde, Pedro Fernando Avalone de",5,200,2026-01-15T10:17:43.474532
"Atienza Rodríguez, Manuel",1,200,2026-01-15T10:17:43.474532
"Atienza, Manuel",1,200,2026-01-15T10:17:43.474532
"Atik, Fernando Antibas",7,200,2026-01-15T10:17:43.474532
"Avalle, Gustavo Leonel Gilardoni",4,200,2026-01-15T10:17:43.474532
"Avanzi, Maria Rita",14,200,2026-01-15T10:17:43.474532
"Avelar, Lúcia Mercês de",11,200,2026-01-15T10:17:43.474532
"Avelino, Daniel Pitangueira de",1,200,2026-01-15T10:17:43.474532
"Avellar, Isa Gomes Jorge de",1,200,2026-01-15T10:17:43.474532
"Avena, Biagio Mauricio",5,200,2026-01-15T10:17:43.474532
"Aveni, Alessandro",3,200,2026-01-15T10:17:43.474532
"Aversi-Ferreira, Tales Alexandre",1,200,2026-01-15T10:17:43.474532
"Aviani, Francisco Leite",2,200,2026-01-15T10:17:43.474532
"Ávila, Antônio Carlos de",1,200,2026-01-15T10:17:43.474532
"Ávila, Marcos Pereira de",7,200,2026-01-15T10:17:43.474532
"Ávila, Mário Lúcio de",25,200,2026-01-15T10:17:43.474532
"Avila, Suzana Moreira",13,200,2026-01-15T10:17:43.474532
"Àvila, Suzana Moreira",1,200,2026-01-15T10:17:43.474532
"Ayala-Rincón, Mauricio",25,250,2026-01-15T10:17:45.686192
"Aydos, Ricardo Dutra",7,250,2026-01-15T10:17:45.686192
"Azevedo, Aldo Antonio de",10,250,2026-01-15T10:17:45.686192
"Azevedo, Ana Vicentini de",3,250,2026-01-15T10:17:45.686192
"Azevedo, Arthur Vicentini Ferreira de",2,250,2026-01-15T10:17:45.686192
"Azevedo, David Lima",10,250,2026-01-15T10:17:45.686192
"Azevedo, Denise Barros de",2,250,2026-01-15T10:17:45.686192
"Azevedo, Maria Cristina de Carvalho Cascelli de",21,250,2026-01-15T10:17:45.686192
"Azevedo, Monalisa Ferreira",4,250,2026-01-15T10:17:45.686192
"Azevêdo, Paulo Henrique",9,250,2026-01-15T10:17:45.686192
"Azevedo, Ricardo Bentes de",42,250,2026-01-15T10:17:45.686192
"Azevedo, Ricardo Silva Araújo",1,250,2026-01-15T10:17:45.686192
"Azevedo, Vânia Cristina Rennó",1,250,2026-01-15T10:17:45.686192
"Bacelar, Agatha Pitombo",1,250,2026-01-15T10:17:45.686192
"Bachelard, Suzanne",1,250,2026-01-15T10:17:45.686192
"Bagno, Marcos Araújo",9,250,2026-01-15T10:17:45.686192
"Bahmad Júnior, Fayez",33,250,2026-01-15T10:17:45.686192
"Baines, Stephen Grant",32,250,2026-01-15T10:17:45.686192
"Bakuzis, Peter",1,250,2026-01-15T10:17:45.686192
"Balaban, Marcelo",11,250,2026-01-15T10:17:45.686192
"Balestro, Moisés Villamil",29,250,2026-01-15T10:17:45.686192
"Balthazar, Jose Carlos",1,250,2026-01-15T10:17:45.686192
"Bambirra, Vânia",1,250,2026-01-15T10:17:45.686192
"Bampi, Luciana Neves da Silva",9,250,2026-01-15T10:17:45.686192
"Bandeira, Lourdes",1,250,2026-01-15T10:17:45.686192
"Bandeira, Lourdes Maria",32,250,2026-01-15T10:17:45.686192
"Báo, Sônia Nair",42,250,2026-01-15T10:17:45.686192
"Baptista, Dulce Maria",7,250,2026-01-15T10:17:45.686192
"Baptista, Gustavo Macedo de Mello",27,250,2026-01-15T10:17:45.686192
"Baptista, Joice de Aguiar",3,250,2026-01-15T10:17:45.686192
"Baptista, Márcio Benedito",1,250,2026-01-15T10:17:45.686192
"Baptista, Sofia Galvão",32,250,2026-01-15T10:17:45.686192
"Bara, Olivier",1,250,2026-01-15T10:17:45.686192
"Baranow, Ulf Gregor",3,250,2026-01-15T10:17:45.686192
"Barbalho, Alexandre de Almeida",1,250,2026-01-15T10:17:45.686192
"Barbalho, Sanderson César Macêdo",17,250,2026-01-15T10:17:45.686192
"Barbara, Tania Cristina Morais Santa",1,250,2026-01-15T10:17:45.686192
"Barbato, Silviane Bonaccorsi",31,250,2026-01-15T10:17:45.686192
"Barbieri, Ana Rita",1,250,2026-01-15T10:17:45.686192
"Barbosa Filho, Nelson Henrique",3,250,2026-01-15T10:17:45.686192
"Barbosa Júnior, Helio Vilela",1,250,2026-01-15T10:17:45.686192
"Barbosa, Adriana de Fátima Alexandrino Lima",7,250,2026-01-15T10:17:45.686192
"Barbosa, Etienne Baldez Louzada",9,250,2026-01-15T10:17:45.686192
"Barbosa, Fabiano Alvim",3,250,2026-01-15T10:17:45.686192
"Barbosa, João Alexandre Ribeiro Gonçalves",8,250,2026-01-15T10:17:45.686192
"Barbosa, Larissa Ferreira Regis",1,250,2026-01-15T10:17:45.686192
"Barbosa, Lívia",4,250,2026-01-15T10:17:45.686192
"Barbosa, Lúcia Maria de Assunção",21,250,2026-01-15T10:17:45.686192
"Barbosa, Marco Aurélio Alves",3,250,2026-01-15T10:17:45.686192
"Barbosa, Maria Alves",4,250,2026-01-15T10:17:45.686192
"Barbosa, Nelson",1,300,2026-01-15T10:17:47.911731
"Barbosa, Paola Ferreira",3,300,2026-01-15T10:17:47.911731
"Barbosa, Sheila Cristina Tolentino",1,300,2026-01-15T10:17:47.911731
"Barbosa, Sidney",30,300,2026-01-15T10:17:47.911731
"Barbosa, Swedenberger do Nascimento",1,300,2026-01-15T10:17:47.911731
"Barbosa, Ycarim Melgaço",1,300,2026-01-15T10:17:47.911731
"Barçante, Magali",1,300,2026-01-15T10:17:47.911731
"Barcellos, Vicente de Paulo Quintella",4,300,2026-01-15T10:17:47.911731
"Bareicha, Paulo Sérgio de Andrade",23,300,2026-01-15T10:17:47.911731
"Baroneza, José Eduardo",5,300,2026-01-15T10:17:47.911731
"Barra, Gustavo Barcelos",8,300,2026-01-15T10:17:47.911731
"Barral, Uidemar Morais",1,300,2026-01-15T10:17:47.911731
"Barreto Filho, Henyo Trindade",3,300,2026-01-15T10:17:47.911731
"Barreto, André Noll",11,300,2026-01-15T10:17:47.911731
"Barreto, Cristiane Gomes",15,300,2026-01-15T10:17:47.911731
"Barreto, Jorge Otávio Maia",2,300,2026-01-15T10:17:47.911731
"Barreto, Júnia Regina de Faria",14,300,2026-01-15T10:17:47.911731
"Barreto, Livia Cristina Lira de Sá",8,300,2026-01-15T10:17:47.911731
"Barreto, Patrícia Regina Pereira",1,300,2026-01-15T10:17:47.911731
"Barreto, Priscila América Solis Mendez",12,300,2026-01-15T10:17:47.911731
"Barreto, Priscila Solis",1,300,2026-01-15T10:17:47.911731
"Barretto Filho, Henyo Trindade",20,300,2026-01-15T10:17:47.911731
"Barrios González, Alia Maria",9,300,2026-01-15T10:17:47.911731
"Barrios, Vicente Carlos Martinez",1,300,2026-01-15T10:17:47.911731
"Barros, Ana Flávia",2,300,2026-01-15T10:17:47.911731
"Barros, Ana Flávia Granja e",6,300,2026-01-15T10:17:47.911731
"Barros, Antonio Teixeira de",1,300,2026-01-15T10:17:47.911731
"Barros, Flávia Lessa de",4,300,2026-01-15T10:17:47.911731
"Barros, Jônatas de França",21,300,2026-01-15T10:17:47.911731
"Barros, Lucas Vieira",4,300,2026-01-15T10:17:47.911731
"Barros, Marília",20,300,2026-01-15T10:17:47.911731
"Barros, Mariluza Araújo Granja e",2,300,2026-01-15T10:17:47.911731
"Barros, Raphael Boechat",7,300,2026-01-15T10:17:47.911731
"Barroso Filho, Wilton",13,300,2026-01-15T10:17:47.911731
"Barroso Neto, Nilton Moura",6,300,2026-01-15T10:17:47.911731
"Barroso, Ana Beatriz de Paiva Costa",1,300,2026-01-15T10:17:47.911731
"Barroso, Eloisa Pereira",27,300,2026-01-15T10:17:47.911731
"Barroso, Eloísa Pereira",1,300,2026-01-15T10:17:47.911731
"Barroso, Hayeska Costa",3,300,2026-01-15T10:17:47.911731
"Barroso, Maria Veralice",1,300,2026-01-15T10:17:47.911731
"Barroso, Nilton",1,300,2026-01-15T10:17:47.911731
"Bartholo Junior, Roberto dos Santos",2,300,2026-01-15T10:17:47.911731
"Basali, Rogério Alessandro de Mello",1,300,2026-01-15T10:17:47.911731
"Baseia, Basilio",1,300,2026-01-15T10:17:47.911731
"Bastos Júnior, Raimundo de Araújo",10,300,2026-01-15T10:17:47.911731
"Bastos, Cristina Schetino",14,300,2026-01-15T10:17:47.911731
"Bastos, Fernando",3,300,2026-01-15T10:17:47.911731
"Bastos, Hermenegildo José de Menezes",16,300,2026-01-15T10:17:47.911731
"Bastos, Izabela Marques Dourado",11,300,2026-01-15T10:17:47.911731
"Batista, Analia Laura Soria",7,300,2026-01-15T10:17:47.911731
"Batista, Carlos Marcos",11,350,2026-01-15T10:17:50.277629
"Batista, Kátia Torres",1,350,2026-01-15T10:17:50.277629
"Batista, Pérola de Oliveira Magalhães Dias",21,350,2026-01-15T10:17:50.277629
"Bauchspiess, Adolfo",12,350,2026-01-15T10:17:50.277629
"Bauer, Elton",49,350,2026-01-15T10:17:50.277629
"Baumann, Renato",1,350,2026-01-15T10:17:50.277629
"Bazzo, Yris Maria Fonseca",2,350,2026-01-15T10:17:50.277629
"Beaklini Filho, José Felippe",6,350,2026-01-15T10:17:50.277629
"Becard, Danielly Silva Ramos",5,350,2026-01-15T10:17:50.277629
"Bécard, Danielly Silva Ramos",5,350,2026-01-15T10:17:50.277629
"Becchio, Raúl",1,350,2026-01-15T10:17:50.277629
"Becker, Vitor Osmar",1,350,2026-01-15T10:17:50.277629
"Belloni, José Ângelo",1,350,2026-01-15T10:17:50.277629
"Bellotto, Valéria Regina",5,350,2026-01-15T10:17:50.277629
"Bellozi, Paula Maria Quaglio",1,350,2026-01-15T10:17:50.277629
"Bem, Andreza Fabro de",7,350,2026-01-15T10:17:50.277629
"Bemquerer, Marcelo Porto",2,350,2026-01-15T10:17:50.277629
"Benck, Rossana Travassos",1,350,2026-01-15T10:17:50.277629
"Beni, Mário Carlos",3,350,2026-01-15T10:17:50.277629
"Bennett, Richard",1,350,2026-01-15T10:17:50.277629
"Bensusan, Hilan",14,350,2026-01-15T10:17:50.277629
"Bensusan, Hilan Nissior",9,350,2026-01-15T10:17:50.277629
"Bentancurt, Juan José Verdesio",1,350,2026-01-15T10:17:50.277629
"Bento, Berenice Alves de Melo",5,350,2026-01-15T10:17:50.277629
"Benvenuti, Marcelo Frota Lobato",4,350,2026-01-15T10:17:50.277629
"Benvindo, Juliano Zaiden",21,350,2026-01-15T10:17:50.277629
"Benzaken, Adele Schwartz",1,350,2026-01-15T10:17:50.277629
"Beraldo, Paulo Sérgio Siebra",2,350,2026-01-15T10:17:50.277629
"Berbel, Neusi Aparecida Navas",1,350,2026-01-15T10:17:50.277629
"Bergamo, Edvaldo Aparecido",24,350,2026-01-15T10:17:50.277629
"Berger, Pedro de Azevedo",2,350,2026-01-15T10:17:50.277629
"Bergsleithner, Joara Martin",7,350,2026-01-15T10:17:50.277629
"Bermejo, Paulo Henrique de Souza",6,350,2026-01-15T10:17:50.277629
"Bermudez, Luis Afonso",5,350,2026-01-15T10:17:50.277629
"Bermudez, Ximena Pamela Claudia Diaz",1,350,2026-01-15T10:17:50.277629
"Bernal, Francisco Ernesto Moreno",14,350,2026-01-15T10:17:50.277629
"Bernardes, Ricardo Silveira",6,350,2026-01-15T10:17:50.277629
"Bernardi, José Vicente Elias",9,350,2026-01-15T10:17:50.277629
"Bernardino-Costa, Joaze",14,350,2026-01-15T10:17:50.277629
"Berryman, Robert",1,350,2026-01-15T10:17:50.277629
"Bertioli, David John",5,350,2026-01-15T10:17:50.277629
"Bertolin, Maria Natacha Toral",8,350,2026-01-15T10:17:50.277629
"Bertussi, Geovana Lorena",6,350,2026-01-15T10:17:50.277629
"Bessa, Luiz Fernando Macedo",16,350,2026-01-15T10:17:50.277629
"Bessler, Karl Eberhard",1,350,2026-01-15T10:17:50.277629
"Bex, Luciana Hagstrom",2,350,2026-01-15T10:17:50.277629
"Bezerra Júnior, Belidson Dias",12,350,2026-01-15T10:17:50.277629
"Bezerra, Ana Cristina Barreto",25,350,2026-01-15T10:17:50.277629
"Bezerra, Ana Lúcia Queiroz",2,350,2026-01-15T10:17:50.277629
"Bezerra, Francisco Hilário Rego",1,350,2026-01-15T10:17:50.277629
"Bezerra, Juscelino Eudamidas",1,400,2026-01-15T10:17:52.497719
"Bezerra, Juscelino Eudâmidas",9,400,2026-01-15T10:17:52.497719
"Bezerra, Lidia Mara Aguiar",5,400,2026-01-15T10:17:52.497719
"Bezerra, Luciano Mendes",47,400,2026-01-15T10:17:52.497719
"Bezerra, Maria do Carmo de Lima",33,400,2026-01-15T10:17:52.497719
"Bezerra, Wescley Well Vicente",3,400,2026-01-15T10:17:52.497719
"Bianco, Nelia Rodrigues Del",3,400,2026-01-15T10:17:52.497719
